webtitle,sectionname,publisheddate,webLinks
Pegasus spyware ‘found on phone of jailed critic of Narendra Modi ’,News,2021-12-17T05:30:19Z,https://www.theguardian.com/news/2021/dec/17/pegasus-spyware-found-on-phone-of-jailed-critic-of-narendra-modi-
How a terrorism law in India is being used to silence Modi’s critics,World news,2021-12-10T05:00:30Z,https://www.theguardian.com/world/2021/dec/10/how-terrorism-law-india-used-to-silence-modis-critics
India’s farmers have won – but this doesn’t mean Modi is softening | Rukmini S,Opinion,2021-11-23T09:50:06Z,https://www.theguardian.com/commentisfree/2021/nov/23/india-farmers-modi-climbdown-dissent
The Guardian view on Modi’s failed farm laws: eating humble pie | Editorial,Opinion,2021-11-22T19:05:22Z,https://www.theguardian.com/commentisfree/2021/nov/22/the-guardian-view-on-modis-failed-farm-laws-eating-humble-pie
Indian PM Narendra Modi to repeal farm laws after year of protests,World news,2021-11-19T17:29:22Z,https://www.theguardian.com/world/2021/nov/19/indian-pm-narendra-modi-to-repeal-farm-laws-after-year-of-protests
‘The strongman blinks’: why Narendra Modi has backed down to farmers,World news,2021-11-19T16:14:05Z,https://www.theguardian.com/world/2021/nov/19/the-strongman-blinks-why-narendra-modi-has-backed-down-to-farmers
‘We are more powerful than Modi’: Indian farmers celebrate U-turn on laws,World news,2021-11-19T13:39:57Z,https://www.theguardian.com/world/2021/nov/19/we-are-more-powerful-than-modi-indian-farmers-celebrate-laws-repealing
Reaching net zero by 2070 is possible – but it’s what India does right now that matters | Joydeep Gupta,Opinion,2021-11-05T12:00:03Z,https://www.theguardian.com/commentisfree/2021/nov/05/net-zero-2070-india-renewables-climate-finance
Is India’s pledge of net zero by 2070 an ambitious target – or worthless words?,World news,2021-11-05T07:00:13Z,https://www.theguardian.com/world/2021/nov/05/is-indias-pledge-of-net-zero-by-2070-an-ambitious-target-or-worthless-words
"India’s huge solar uptake has boosted climate goals, says minister",World news,2021-11-03T13:01:30Z,https://www.theguardian.com/world/2021/nov/03/indias-huge-uptake-in-solar-is-driving-more-ambitious-climate-goals-says-minister
Scott Morrison tells Cop26 Australia will exceed 2030 target in bid to fend off criticism,Australia news,2021-11-01T20:16:49Z,https://www.theguardian.com/environment/2021/nov/02/scott-morrison-tells-cop26-australia-will-exceed-2030-target-in-bid-to-fend-off-criticism
What happened at Cop26 today – day one at a glance,Environment,2021-11-01T19:01:20Z,https://www.theguardian.com/environment/2021/nov/01/what-happened-at-cop26-day-one-at-a-glance
Narendra Modi pledges India will reach net zero emissions by 2070,World news,2021-11-01T17:20:20Z,https://www.theguardian.com/world/2021/nov/01/narendra-modi-pledges-india-will-reach-net-zero-emissions-by-2070
Indian supreme court orders inquiry into state’s use of Pegasus spyware,News,2021-10-27T10:01:42Z,https://www.theguardian.com/news/2021/oct/27/indian-supreme-court-orders-inquiry-into-states-use-of-pegasus-spyware
Narendra Modi exploits nationalism to distract Indians from a failing economy | Ravinder Kaur,Opinion,2021-08-20T09:00:31Z,https://www.theguardian.com/commentisfree/2021/aug/20/narendra-modi-exploits-nationalism-distract-indians-failing-economy
The unravelling of a conspiracy: were the 16 charged with plotting to kill India’s prime minister framed?,World news,2021-08-12T11:00:16Z,https://www.theguardian.com/world/2021/aug/12/bhima-koregaon-case-india-conspiracy-modi
"Ban Amnesty over Pegasus leaks role, Indian politician urges",News,2021-07-21T14:40:48Z,https://www.theguardian.com/news/2021/jul/21/ban-amnesty-over-pegasus-leaks-role-indian-politician-urges
Modi accused of treason by opposition over India spyware disclosures,News,2021-07-19T17:33:06Z,https://www.theguardian.com/news/2021/jul/19/modi-accused-treason-opposition-india-spyware-disclosures
Key Modi rival Rahul Gandhi among potential Indian targets of NSO client,News,2021-07-19T11:00:56Z,https://www.theguardian.com/news/2021/jul/19/key-modi-rival-rahul-gandhi-among-indian-targets-of-nso-client
Student’s rape and murder puts India’s sexual violence under spotlight again,Global development,2021-06-11T05:00:10Z,https://www.theguardian.com/global-development/2021/jun/11/students-and-puts-indias-sexual-violence-under-spotlight-again
Modi’s bulldozing of parliament shows him as the architect of a Hindu Taliban | Anish Kapoor,Art and design,2021-06-04T14:27:31Z,https://www.theguardian.com/artanddesign/2021/jun/04/modi-parliament-taliban-anish-kapoor
Trouble in paradise: Indian islands face ‘brazen’ new laws and Covid crisis,Global development,2021-06-04T05:00:30Z,https://www.theguardian.com/global-development/2021/jun/04/trouble-in-paradise-indian-islands-face-brazen-new-laws-and-covid-crisis
Officials take police action against leaders of bulldozed mosque in India,World news,2021-05-21T12:29:54Z,https://www.theguardian.com/world/2021/may/21/officials-take-police-action-against-leaders-of-bulldozed-mosque-in-india
Indian authors speak out over plan to reissue Narendra Modi exam book,Books,2021-05-20T12:53:37Z,https://www.theguardian.com/books/2021/may/20/indian-authors-speak-out-over-plan-to-reissue-narendra-modi-exam-book
‘Everybody is angry’: Modi under fire over India’s Covid second wave,World news,2021-05-17T04:00:13Z,https://www.theguardian.com/world/2021/may/17/everybody-is-angry-modi-under-fire-over-indias-covid-second-wave
India’s Covid anguish fuels calls to release rights activists from jail,World news,2021-05-13T09:07:05Z,https://www.theguardian.com/world/2021/may/13/india-covid-anguish-fuels-calls-to-release-human-rights-activists-from-jails
India is hiding its Covid crisis – and the whole world will suffer for it | Ankita Rao,Opinion,2021-05-06T10:17:05Z,https://www.theguardian.com/commentisfree/2021/may/06/india-covid-crisis-narenda-modi-government-hiding
The darkest hour- India’s Covid crisis: Inside the 7 May Guardian Weekly,News,2021-05-05T08:00:09Z,https://www.theguardian.com/news/2021/may/05/the-darkest-hour--indias-covid-crisis-inside-the-7-may-guardian-weekly
"Looking at India from afar, I’m furious at Modi’s wilful neglect of my homeland",Opinion,2021-05-04T16:13:27Z,https://www.theguardian.com/commentisfree/2021/may/04/india-modi-covid
Johnson and Modi to agree UK-India trade partnership in virtual talks,Politics,2021-05-03T21:30:11Z,https://www.theguardian.com/politics/2021/may/03/johnson-and-modi-to-agree-uk-india-trade-partnership-in-virtual-talks
Covering India’s Covid crisis: ‘Hundreds of journalists have lost their lives’,Membership,2021-05-03T06:00:53Z,https://www.theguardian.com/membership/2021/may/03/india-covid-deaths-crisis-kumbh-mela
Narendra Modi loses key state election as Covid grips India,World news,2021-05-02T16:38:36Z,https://www.theguardian.com/world/2021/may/02/narendra-modi-loses-key-state-election-west-bengal-covid-grips-india
Grief and anger as Covid victims overwhelm Delhi’s crematoriums ,World news,2021-04-30T11:25:02Z,https://www.theguardian.com/world/2021/apr/30/covid-victims-overwhelm-delhi-crematoriums
Facebook blocked hashtag calling for Narendra Modi to resign over pandemic,Technology,2021-04-28T21:52:20Z,https://www.theguardian.com/technology/2021/apr/28/facebook-blocked-resignmodi-hashtag-india-coronavirus
Vaccine hoarding is all the more disturbing as a Covid disaster unfolds in India  | Gaby Hinsliff,Opinion,2021-04-26T13:55:29Z,https://www.theguardian.com/commentisfree/2021/apr/26/vaccine-hoarding-covid-tragedy-india-britain-vaccinated
US and UK lead global efforts to help India’s Covid crisis,World news,2021-04-25T18:26:57Z,https://www.theguardian.com/world/2021/apr/25/us-pressed-to-lift-export-ban-to-help-india-fight-surge-in-covid-cases
The Guardian view on Modi’s mistakes: a pandemic that is out of control  | Editorial,Global,2021-04-23T17:01:02Z,https://www.theguardian.com/world/commentisfree/2021/apr/23/the-guardian-view-on-modis-mistakes-a-pandemic-that-is-out-of-control
India's government has abandoned its citizens to face a deadly second wave alone | Rukmini S,Opinion,2021-04-21T11:23:40Z,https://www.theguardian.com/commentisfree/2021/apr/21/indias-government-abandoned-citizens-deadly-second-covid-wave
Why is India seeing such a huge surge in Covid-19 cases?,World news,2021-04-21T05:33:06Z,https://www.theguardian.com/world/2021/apr/21/why-is-india-seeing-such-a-huge-surge-in-covid-19-cases
Narendra Modi: Covid resurgence in India like being ‘hit by a storm’ ,World news,2021-04-20T17:13:49Z,https://www.theguardian.com/world/2021/apr/20/narendra-modi-covid-resurgence-in-india-like-being-hit-by-a-storm
Tech giants happy to do Narendra Modi’s bidding in return for access to Indian market | John Naughton,Technology,2021-04-17T15:00:37Z,https://www.theguardian.com/technology/commentisfree/2021/apr/17/tech-giants-happy-to-do-narendra-modis-bidding-indian-market-facebook-twitter
‘A tsunami of cases’: desperation as Covid second wave batters India,World news,2021-04-14T02:00:26Z,https://www.theguardian.com/world/2021/apr/14/a-tsunami-of-cases-desperation-as-covid-second-wave-batters-india
UK faces difficult path as it resumes courtship with India,UK news,2021-04-06T04:00:55Z,https://www.theguardian.com/uk-news/2021/apr/06/uk-faces-difficult-path-as-it-resumes-courtship-with-india
Modi critic's resignation from Indian university post prompts outcry,World news,2021-03-19T14:53:13Z,https://www.theguardian.com/world/2021/mar/19/modi-critics-resignation-from-indian-university-post-sparks-outcry
UK foreign policy review will focus on China's growing power,Politics,2021-03-05T16:41:25Z,https://www.theguardian.com/politics/2021/mar/05/uk-foreign-policy-review-china-asia-brexit
"British Sikh 'tortured' in India after arrest must be freed, say MPs",World news,2021-02-28T19:47:37Z,https://www.theguardian.com/world/2021/feb/28/british-sikh-tortured-in-india-after-arrest-must-be-freed-say-mps
Delhi Muslims fear they will never see justice for religious riot atrocities,World news,2021-02-28T06:00:06Z,https://www.theguardian.com/world/2021/feb/28/delhi-muslims-fear-they-will-never-see-justice-for-religious-riot-atrocities
"If India can charge journalists with ‘sedition’ for doing their jobs, it has no free press | Hartosh Singh Bal",Opinion,2021-02-06T10:00:38Z,https://www.theguardian.com/commentisfree/2021/feb/06/india-journalists-sedition-no-free-press-police-farmers-modi
Violent clashes as Indian farmers storm Delhi's Red Fort,World news,2021-01-26T13:44:52Z,https://www.theguardian.com/world/2021/jan/26/violent-clashes-as-indian-farmers-storm-delhis-red-fort
The Guardian view on India's farming revolt: a bitter harvest | Editorial,Opinion,2021-01-24T18:25:05Z,https://www.theguardian.com/commentisfree/2021/jan/24/the-guardian-view-on-indias-farming-revolt-a-bitter-harvest
'We are worried': Indians hopeful but anxious as vaccination drive begins,Global development,2021-01-17T16:33:56Z,https://www.theguardian.com/global-development/2021/jan/17/indian-hopeful-anxious-covid-vaccination-drive-begins
Trump social media ban sparks calls for action against other populist leaders,Media,2021-01-17T08:00:12Z,https://www.theguardian.com/media/2021/jan/17/trump-social-media-ban-jair-bolsonaro-narendra-modi
Mahatma Gandhi's killer venerated as Hindu nationalism resurges in India,World news,2021-01-17T05:00:07Z,https://www.theguardian.com/world/2021/jan/17/mahatma-gandhis-killer-venerated-as-hindu-nationalism-resurges-in-india
India begins world's biggest Covid vaccination programme,World news,2021-01-16T08:57:01Z,https://www.theguardian.com/world/2021/jan/16/india-begins-worlds-biggest-covid-vaccination-programme
India's supreme court gives go-ahead for controversial new parliament building,World news,2021-01-05T18:03:50Z,https://www.theguardian.com/world/2021/jan/05/indias-supreme-court-gives-go-ahead-for-controversial-new-parliament-building
India's approval of covid vaccines triggers mass immunisation drive,World news,2021-01-03T13:47:14Z,https://www.theguardian.com/world/2021/jan/03/indias-approval-of-twin-vaccines-triggers-mass-immunisation-drive
